,baselineA_awake_lunch,baselineA_diner_sleep,baselineA_lunch_diner,baselineB_intentions1,baselineB_intentions2,baselineB_intentions3,baselineB_intentions4,baselineC_importance1,baselineC_importance2,baselineC_success1,baselineC_success2,baselineD_age,baselineD_education,baselineD_location,baselineD_sex,baselineE_personality1,baselineE_personality10,baselineE_personality11,baselineE_personality2,baselineE_personality3,baselineE_personality4,baselineE_personality5,baselineE_personality6,baselineE_personality7,baselineE_personality8,baselineE_personality9,controlGroup,day 10_awake_lunch,day 10_diner_sleep,day 10_lunch_diner,day 11_awake_lunch,day 11_diner_sleep,day 11_lunch_diner,day 12_awake_lunch,day 12_diner_sleep,day 12_lunch_diner,day 13_awake_lunch,day 13_diner_sleep,day 13_lunch_diner,day 14_awake_lunch,day 14_diner_sleep,day 14_lunch_diner,day 15_awake_lunch,day 15_diner_sleep,day 15_lunch_diner,day 1_awake_lunch,day 1_diner_sleep,day 1_lunch_diner,day 2_awake_lunch,day 2_diner_sleep,day 2_lunch_diner,day 3_awake_lunch,day 3_diner_sleep,day 3_lunch_diner,day 4000_awake_lunch,day 4000_diner_sleep,day 4000_lunch_diner,day 4_awake_lunch,day 4_diner_sleep,day 4_lunch_diner,day 5_awake_lunch,day 5_diner_sleep,day 5_lunch_diner,day 6_awake_lunch,day 6_diner_sleep,day 6_lunch_diner,day 7_awake_lunch,day 7_diner_sleep,day 7_lunch_diner,day 8_awake_lunch,day 8_diner_sleep,day 8_lunch_diner,day 9_awake_lunch,day 9_diner_sleep,day 9_lunch_diner,email,endA_endAvoid1,endA_endAvoid2,endA_endAvoid3,endA_endAvoid4,endB_endControl1,endB_endControl2,endB_endControl3,endB_endControl4,endB_endGoals1,endB_endGoals2,endB_endGoals3,endB_endGoals4,endC_endDistraction1,endC_endDistraction2,endC_endDistraction3,endC_endDistraction4,endC_endRules1,endC_endRules2,endC_endRules3,endC_endRules4,endD_endPsychological1,endD_endPsychological2,endD_endPsychological3,endD_endPsychological4,endD_endSuppress1,endD_endSuppress2,endD_endSuppress3,endD_endSuppress4,endE_betMin,endE_betVerv,endE_betWeerst,endF_mot1,endF_mot2,endG_appBer,endG_appCont,endG_appCrash,endG_appHulp,endG_appLog,endG_appTips,endG_batt,endG_userFriend,endH_dagVU,endH_dieet,endH_eetProb,endH_taal,endH_ziek,message 10_at,message 10_oke,message 10_text,message 11_at,message 11_oke,message 11_text,message 12_at,message 12_oke,message 12_text,message 13_at,message 13_oke,message 13_text,message 14_at,message 14_oke,message 14_text,message 15_at,message 15_oke,message 15_text,message 16_at,message 16_oke,message 16_text,message 17_at,message 17_oke,message 17_text,message 18_at,message 18_oke,message 18_text,message 19_at,message 19_oke,message 19_text,message 1_at,message 1_oke,message 1_text,message 201_at,message 201_oke,message 201_text,message 202_at,message 202_oke,message 202_text,message 203_at,message 203_oke,message 203_text,message 204_at,message 204_oke,message 204_text,message 205_at,message 205_oke,message 205_text,message 206_at,message 206_oke,message 206_text,message 207_at,message 207_oke,message 207_text,message 208_at,message 208_oke,message 208_text,message 209_at,message 209_oke,message 209_text,message 20_at,message 20_oke,message 20_text,message 210_at,message 210_oke,message 210_text,message 211_at,message 211_oke,message 211_text,message 212_at,message 212_oke,message 212_text,message 213_at,message 213_oke,message 213_text,message 214_at,message 214_oke,message 214_text,message 215_at,message 215_oke,message 215_text,message 216_at,message 216_oke,message 216_text,message 217_at,message 217_oke,message 217_text,message 218_at,message 218_oke,message 218_text,message 219_at,message 219_oke,message 219_text,message 21_at,message 21_oke,message 21_text,message 226_at,message 226_oke,message 226_text,message 22_at,message 22_oke,message 22_text,message 238_at,message 238_oke,message 238_text,message 23_at,message 23_oke,message 23_text,message 240_at,message 240_oke,message 240_text,message 243_at,message 243_oke,message 243_text,message 246_at,message 246_oke,message 246_text,message 247_at,message 247_oke,message 247_text,message 24_at,message 24_oke,message 24_text,message 250_at,message 250_oke,message 250_text,message 252_at,message 252_oke,message 252_text,message 25_at,message 25_oke,message 25_text,message 260_at,message 260_oke,message 260_text,message 262_at,message 262_oke,message 262_text,message 263_at,message 263_oke,message 263_text,message 26_at,message 26_oke,message 26_text,message 270_at,message 270_oke,message 270_text,message 274_at,message 274_oke,message 274_text,message 27_at,message 27_oke,message 27_text,message 280_at,message 280_oke,message 280_text,message 288_at,message 288_oke,message 288_text,message 289_at,message 289_oke,message 289_text,message 28_at,message 28_oke,message 28_text,message 29_at,message 29_oke,message 29_text,message 2_at,message 2_oke,message 2_text,message 305_at,message 305_oke,message 305_text,message 30_at,message 30_oke,message 30_text,message 315_at,message 315_oke,message 315_text,message 317_at,message 317_oke,message 317_text,message 31_at,message 31_oke,message 31_text,message 321_at,message 321_oke,message 321_text,message 32_at,message 32_oke,message 32_text,message 330_at,message 330_oke,message 330_text,message 33_at,message 33_oke,message 33_text,message 349_at,message 349_oke,message 349_text,message 34_at,message 34_oke,message 34_text,message 350_at,message 350_oke,message 350_text,message 353_at,message 353_oke,message 353_text,message 35_at,message 35_oke,message 35_text,message 36_at,message 36_oke,message 36_text,message 37_at,message 37_oke,message 37_text,message 380_at,message 380_oke,message 380_text,message 383_at,message 383_oke,message 383_text,message 38_at,message 38_oke,message 38_text,message 39_at,message 39_oke,message 39_text,message 3_at,message 3_oke,message 3_text,message 40_at,message 40_oke,message 40_text,message 41_at,message 41_oke,message 41_text,message 42_at,message 42_oke,message 42_text,message 43_at,message 43_oke,message 43_text,message 44_at,message 44_oke,message 44_text,message 45_at,message 45_oke,message 45_text,message 46_at,message 46_oke,message 46_text,message 47_at,message 47_oke,message 47_text,message 48_at,message 48_oke,message 48_text,message 49_at,message 49_oke,message 49_text,message 4_at,message 4_oke,message 4_text,message 50_at,message 50_oke,message 50_text,message 51_at,message 51_oke,message 51_text,message 52_at,message 52_oke,message 52_text,message 53_at,message 53_oke,message 53_text,message 5_at,message 5_oke,message 5_text,message 6_at,message 6_oke,message 6_text,message 7_at,message 7_oke,message 7_text,message 8_at,message 8_oke,message 8_text,message 9_at,message 9_oke,message 9_text,startingDay,strategiesA_avoid1,strategiesA_avoid2,strategiesA_avoid3,strategiesA_avoid4,strategiesB_control1,strategiesB_control2,strategiesB_control3,strategiesB_control4,strategiesB_goals1,strategiesB_goals2,strategiesB_goals3,strategiesB_goals4,strategiesC_distraction1,strategiesC_distraction2,strategiesC_distraction3,strategiesC_distraction4,strategiesC_rules1,strategiesC_rules2,strategiesC_rules3,strategiesC_rules4,strategiesD_psychological1,strategiesD_psychological2,strategiesD_psychological3,strategiesD_psychological4,strategiesD_suppress1,strategiesD_suppress2,strategiesD_suppress3,strategiesD_suppress4
0,0,6,14,4,4,3,2,4,4,2,4,20,8,4,man,3,4,3,1,4,2,5,5,4,4,4,4,0,0,0,0,0,0,0,0,0,0,3,0,0,1,0,0,0,0,0,0,0,0,0,1,0,0,1,,,,0,0,0,0,0,0,0,0,0,0,0,0,0,1,0,0,0,0,hiddelekanne@gmail.com,1,4,4,1,2,4,5,3,4,1,4,5,1,3,5,1,5,4,5,5,2,5,5,2,4,5,5,5,5,5,4,5,4,2,5,2,5,4,1,3,2,4,3,2,1,0,2018-02-05T15:03:00.453Z,2018-02-05T16:20:24.020Z,"Maak dit plan: Als ik in de verleiding kom om iets ongezonds te eten, denk ik eraan dat “nee!” zeggen beter past bij hoe ik mijzelf graag zie.",2018-02-06T15:04:00.453Z,2018-02-06T16:28:02.033Z,"Maak dit plan: Als ik samenwerk met mensen die iets lekkers eten, dan negeer ik het lekkers.",2018-02-07T15:03:00.453Z,2018-02-07T18:02:48.107Z,Neem je eens voor: Ik gebruik mijn wilskracht om uit de buurt van ongezonde snacks te blijven.,2018-02-08T15:01:00.458Z,2018-02-08T15:38:41.099Z,Neem je eens voor: Ik maak specifieke plannen hoe ik minder ongezonde snacks kan eten.,2018-02-09T15:09:00.458Z,2018-02-09T15:10:43.274Z,Neem je eens voor: Ik gebruik mijn wilskracht om uit de buurt van ongezonde snacks te blijven.,2018-02-10T15:08:00.459Z,2018-02-10T15:08:29.761Z,"Maak dit plan: Als ik op een plek ben waar ik ongezonde snacks kan krijgen (bijv. een feestje), negeer ik de ongezonde snacks.",,,,,,,,,,,,,2018-01-27T15:01:00.442Z,2018-01-27T16:22:52.885Z,"Maak dit plan: Als ik zin heb in iets lekkers, bedenk ik waarom ik minder ongezonde snacks wil eten.",,,,,,,,,,,,,,,,,,,,,,,,,,,,,,,,,,,,,,,,,,,,,,,,,,,,,,,,,,,,,,,,,,,,,,,,,,,,2018-02-06T07:47:11.363Z,2018-02-06T16:28:06.767Z,"Maak dit plan: Als ik in de verleiding kom om iets ongezonds te eten, denk ik eraan dat “nee!” zeggen beter past bij hoe ik mijzelf graag zie.",,,,,,,,,,,,,,,,,,,,,,,,,,,,,,,,,,,,,,,,,,,,,,,,,,,,,,,,,,2018-01-28T15:06:00.443Z,2018-01-28T20:33:50.893Z,Neem je eens voor: Ik maak specifieke plannen hoe ik minder ongezonde snacks kan eten.,,,,,,,,,,,,,2018-02-06T07:47:11.893Z,2018-02-06T16:28:08.173Z,Neem je eens voor: Ik gebruik mijn wilskracht om uit de buurt van ongezonde snacks te blijven.,,,,,,,,,,,,,,,,,,,,,,,,,,,,,,,,,,,,,,,,,,,,,,2018-01-29T15:07:00.444Z,2018-01-29T15:14:09.328Z,"Maak dit plan: Als ik op een plek ben waar ik ongezonde snacks kan krijgen (bijv. een feestje), negeer ik de ongezonde snacks.",,,,,,,,,,,,,,,,,,,,,,,,,,,,,,,2018-01-30T15:03:00.445Z,2018-01-30T15:51:00.707Z,Neem je eens voor: Ik gebruik mijn wilskracht om uit de buurt van ongezonde snacks te blijven.,,,,,,,,,,,,,2018-01-31T15:07:00.447Z,2018-01-31T15:12:48.997Z,"Neem je eens voor: Als ik iets lekkers wil, denk ik eraan dat het behalen van mijn lange termijn doelen belangrijker is dan het kortstondige plezier van het eten van een ongezonde snack.",2018-02-01T15:02:00.448Z,2018-02-01T15:03:33.329Z,"Maak dit plan: Als ik samenwerk met mensen die iets lekkers eten, dan negeer ik het lekkers.",,,,2018-02-03T15:02:00.449Z,2018-02-03T18:46:00.475Z,"Neem je eens voor: Als ik ongezonde snacks wil eten, zeg ik gewoon “nee!” tegen mezelf.",2018-02-04T15:02:00.449Z,2018-02-04T16:49:17.028Z,"Neem je eens voor: Als ik iets lekkers wil, denk ik eraan dat het behalen van mijn lange termijn doelen belangrijker is dan het kortstondige plezier van het eten van een ongezonde snack.",2018-01-26T17:35:44.371Z,2,5,5,2,3,4,2,4,4,2,4,4,3,4,4,4,4,1,4,4,2,2,1,1,2,5,2,4
1,4,0,3,5,5,5,5,4,5,4,2,24,8,1,man,4,3,3,3,3,3,3,4,2,3,2,3,1,1,1,1,2,0,1,0,0,1,1,1,0,0,0,1,1,2,0,1,0,0,0,1,0,0,1,,,,0,0,2,0,0,0,0,0,1,1,1,0,1,0,1,0,1,1,ali_e27@hotmail.com,3,4,3,3,3,2,2,3,3,4,3,3,3,2,2,2,2,2,2,3,2,3,2,3,2,2,2,2,4,3,3,3,4,3,2,0,4,3,4,2,4,2,3,2,2,0,2018-02-02T10:05:00.459Z,2018-02-03T10:08:43.382Z,Neem je eens voor: Ik stel doelen voor mezelf om gezond te eten.,2018-02-03T10:06:00.460Z,2018-02-03T10:08:44.481Z,"Maak dit plan: Als ik het gevoel heb dat ik te veel eet, denk ik eraan dat dit niet goed is voor het sporten.",2018-02-04T10:00:00.460Z,2018-03-01T12:50:23.444Z,"Maak dit plan: Als ik zin heb in een ongezonde snack, neem ik eerst een stuk fruit.",2018-02-05T10:05:00.460Z,2018-03-01T12:50:30.528Z,"Maak dit plan: Als ik op een plek ben waar ik ongezonde snacks kan krijgen (bijv. een feestje), negeer ik de ongezonde snacks.",2018-02-06T10:07:00.479Z,2018-03-01T12:50:27.116Z,"Maak dit plan: Ik maak plannen om fruit mee naar mijn werkplek (bijv. kantoor, school).",2018-02-07T10:03:00.480Z,2018-03-01T13:00:33.405Z,Neem je eens voor: Ik spreek met mezelf af hoeveel snacks ik per dag mag hebben.,,,,,,,,,,,,,2018-01-24T10:09:00.412Z,2018-01-25T00:20:48.621Z,"Maak dit plan: Ik maak plannen om fruit mee naar mijn werkplek (bijv. kantoor, school).",,,,,,,,,,,,,,,,,,,,,,,,,,,,,,,,,,,,,,,,,,,,,,,,,,,,,,,,,,2018-01-25T18:59:53.098Z,2018-01-25T19:03:15.692Z,Neem je eens voor: Ik gebruik mijn wilskracht om uit de buurt van ongezonde snacks te blijven.,,,,2018-01-26T08:12:46.597Z,2018-01-28T18:02:13.189Z,"Neem je eens voor: Als ik ongezonde snacks wil eten, zeg ik gewoon “nee!” tegen mezelf.",,,,,,,,,,,,,,,,,,,,,,,,,2018-01-30T18:02:10.044Z,2018-02-03T10:08:45.577Z,"Maak dit plan: Als ik zin heb in iets lekkers, bedenk ik waarom ik minder ongezonde snacks wil eten.",2018-01-30T22:30:32.103Z,2018-02-03T10:08:47.493Z,Neem je eens voor: Ik stel doelen voor mezelf om gezond te eten.,,,,2018-02-01T22:21:17.363Z,2018-02-03T10:08:52.299Z,"Maak dit plan: Als ik zin heb in een ongezonde snack, bedenk ik dat ik er leuk wil blijven uitzien.",,,,,,,,,,,,,,,,,,,,,,,,,,,,,,,,,,2018-01-25T10:06:00.414Z,2018-01-25T19:03:11.787Z,Neem je eens voor: Ik stel doelen voor mezelf om gezond te eten.,,,,,,,,,,,,,2018-01-25T18:59:56.678Z,2018-01-25T19:03:18.576Z,"Neem je eens voor: Als ik iets lekkers wil, denk ik eraan dat het behalen van mijn lange termijn doelen belangrijker is dan het kortstondige plezier van het eten van een ongezonde snack.",,,,2018-01-25T19:02:56.897Z,2018-01-25T19:03:20.443Z,"Neem je eens voor: Als ik in de verleiding kom om een ongezonde snack te kopen, leid ik mezelf af.",2018-02-16T08:40:43.934Z,2018-03-01T12:50:33.497Z,"Maak dit plan: Als ik op een plek ben waar ik ongezonde snacks kan krijgen (bijv. een feestje), negeer ik de ongezonde snacks.",2018-01-26T08:12:48.416Z,2018-01-28T18:02:14.288Z,"Maak dit plan: Als ik zin heb in een ongezonde snack, neem ik eerst een stuk fruit.",2018-02-28T08:19:14.413Z,2018-03-01T13:01:05.713Z,"Maak dit plan: Als ik zin heb in iets ongezonds, ga ik iets anders doen.",2018-01-26T08:14:45.667Z,2018-01-28T18:02:16.831Z,"Maak dit plan: Als ik op een plek ben waar ik ongezonde snacks kan krijgen (bijv. een feestje), negeer ik de ongezonde snacks.",2018-02-28T10:49:33.950Z,2018-03-01T13:01:08.295Z,"Maak dit plan: Als ik zin heb in iets lekkers, bedenk ik waarom ik minder ongezonde snacks wil eten.",2018-02-28T12:38:49.779Z,2018-03-01T13:01:11.887Z,"Maak dit plan: Als ik samenwerk met mensen die iets lekkers eten, dan negeer ik het lekkers.",2018-01-26T12:48:36.903Z,2018-01-28T18:02:18.066Z,"Maak dit plan: Als ik het gevoel heb dat ik te veel eet, denk ik eraan dat dit niet goed is voor het sporten.",2018-01-30T18:02:10.693Z,2018-02-03T10:08:46.549Z,"Neem je eens voor: Als ik in de verleiding kom om een ongezonde snack te kopen, leid ik mezelf af.",2018-01-30T22:30:36.809Z,2018-02-03T10:08:49.227Z,"Maak dit plan: Als ik op een plek ben waar ik ongezonde snacks kan krijgen (bijv. een feestje), negeer ik de ongezonde snacks.",2018-03-01T19:36:42.894Z,2018-03-02T12:13:01.404Z,"Neem je eens voor: Als ik zin heb in iets ongezonds, denk ik na of ik het wel echt wil. ",2018-03-02T12:09:24.706Z,2018-03-02T12:13:04.029Z,Neem je eens voor: Ik stel doelen voor mezelf om gezond te eten.,2018-02-01T22:21:19.659Z,2018-02-03T10:08:54.946Z,"Maak dit plan: Als ik zin heb in een ongezonde snack, neem ik eerst een stuk fruit.",2018-02-15T11:53:08.150Z,2018-02-15T13:03:52.837Z,"Maak dit plan: Als ik iets lekkers wil eten, neem ik een klein beetje en leg ik de rest weg.",2018-01-26T10:01:00.414Z,2018-01-28T18:01:48.994Z,"Neem je eens voor: Als ik iets lekkers wil, denk ik eraan dat het behalen van mijn lange termijn doelen belangrijker is dan het kortstondige plezier van het eten van een ongezonde snack.",2018-02-16T08:40:45.689Z,2018-03-01T13:00:58.552Z,"Maak dit plan: Als ik iets lekkers wil, haal ik iets kleins in plaats van een grote verpakking.",2018-02-16T08:41:13.356Z,2018-03-01T13:01:02.787Z,"Maak dit plan: Als ik zin heb in een ongezonde snack, bedenk ik dat ik er leuk wil blijven uitzien.",2018-02-28T08:16:29.360Z,2018-03-01T12:50:38.443Z,"Maak dit plan: Als ik me verveel, zorg ik dat ik uit de buurt blijf van plekken waar ik ongezonde snacks kan krijgen (bijv. de keuken).",2018-02-28T08:19:14.784Z,2018-03-01T13:01:07.313Z,"Neem je eens voor: Als ik op pad ben, zorg ik er voor dat ik niet in de buurt kom van plekken waar ongezonde snacks worden verkocht (bijv. restaurant of snackbar).",2018-02-28T10:49:38.757Z,2018-03-01T13:01:10.881Z,"Maak dit plan: Als ik in de verleiding kom om iets ongezonds te eten, denk ik eraan dat “nee!” zeggen beter past bij hoe ik mijzelf graag zie.",2018-02-28T12:38:51.774Z,2018-03-01T12:50:15.877Z,Neem je eens voor: Ik maak specifieke plannen hoe ik minder ongezonde snacks kan eten.,2018-03-01T19:36:44.097Z,2018-03-02T12:13:02.969Z,"Maak dit plan: Als ik iets lekkers wil eten, neem ik een klein beetje en leg ik de rest weg.",2018-03-02T12:09:26.512Z,2018-03-02T12:13:07.121Z,"Neem je eens voor: Als ik naar de supermarkt ga, vermijd ik het schap met ongezonde snacks (bijv. de snoepafdeling).",2018-03-02T12:09:38.618Z,2018-03-02T12:13:08.486Z,"Neem je eens voor: Als ik naar de supermarkt ga, vermijd ik het schap met ongezonde snacks (bijv. de snoepafdeling).",2018-03-02T12:10:49.044Z,2018-03-02T12:13:10.072Z,"Neem je eens voor: Als ik op pad ben, zorg ik er voor dat ik niet in de buurt kom van plekken waar ongezonde snacks worden verkocht (bijv. restaurant of snackbar).",2018-01-27T10:00:00.415Z,2018-01-28T18:02:12.030Z,"Neem je eens voor: Als ik honger krijg voor het avondeten, probeer ik mezelf bezig te houden.",,,,,,,,,,,,,2018-01-28T10:02:00.418Z,2018-01-28T18:02:10.262Z,Neem je eens voor: Ik maak specifieke plannen hoe ik minder ongezonde snacks kan eten.,2018-01-29T10:05:00.419Z,2018-02-03T10:08:37.617Z,"Maak dit plan: Als ik in de verleiding kom om iets ongezonds te eten, denk ik eraan dat “nee!” zeggen beter past bij hoe ik mijzelf graag zie.",2018-01-30T10:05:00.433Z,2018-02-03T10:08:39.492Z,"Maak dit plan: Als ik samenwerk met mensen die iets lekkers eten, dan negeer ik het lekkers.",2018-01-31T10:07:00.458Z,2018-02-03T10:08:40.972Z,"Maak dit plan: Als ik me verveel, zorg ik dat ik uit de buurt blijf van plekken waar ik ongezonde snacks kan krijgen (bijv. de keuken).",2018-02-01T10:07:00.459Z,2018-02-03T10:08:42.375Z,"Maak dit plan: Als ik zin heb om iets lekkers te eten, ga ik in plaats daarvan even met iemand kletsen.",2018-01-23T22:11:10.903Z,3,2,3,3,3,3,4,4,3,4,4,4,4,4,3,4,4,3,4,4,4,4,4,4,3,4,4,3
